{
  "survey": {
    "id": "AI_STUDENT_001",
    "title": "大学生AI学习工具使用情况调查",
    "version": "1.0.0",
    "intro": "亲爱的同学，您好！本问卷用于了解大学生使用AI学习工具的情况，采用匿名方式，数据仅用于课程研究。感谢您的参与！",
    "changelog": [
      {
        "version": "1.0.0",
        "date": "2026-09-16",
        "note": "初始版本"
      }
    ]
  },
  "sections": [
    {
      "id": "S1",
      "title": "基本信息",
      "question_ids": [
        "Q01",
        "Q02",
        "Q03"
      ]
    },
    {
      "id": "S2",
      "title": "使用行为",
      "question_ids": [
        "Q04",
        "Q05",
        "Q06",
        "Q07",
        "Q08"
      ]
    },
    {
      "id": "S3",
      "title": "使用体验与满意度",
      "question_ids": [
        "Q09",
        "Q10",
        "Q11"
      ]
    },
    {
      "id": "S4",
      "title": "开放建议",
      "question_ids": [
        "Q12"
      ]
    }
  ],
  "questions": [
    {
      "id": "Q01",
      "type": "single_choice",
      "text": "您的性别是",
      "construct": "人口学",
      "variable": "gender",
      "analysis_role": "grouping_variable",
      "measurement_level": "nominal",
      "options": [
        {
          "id": "A",
          "label": "男",
          "value": 1
        },
        {
          "id": "B",
          "label": "女",
          "value": 2
        }
      ]
    },
    {
      "id": "Q02",
      "type": "single_choice",
      "text": "您的年级是",
      "construct": "人口学",
      "variable": "grade",
      "analysis_role": "grouping_variable",
      "measurement_level": "ordinal",
      "options": [
        {
          "id": "A",
          "label": "大一",
          "value": 1
        },
        {
          "id": "B",
          "label": "大二",
          "value": 2
        },
        {
          "id": "C",
          "label": "大三",
          "value": 3
        },
        {
          "id": "D",
          "label": "大四",
          "value": 4
        },
        {
          "id": "E",
          "label": "研究生及以上",
          "value": 5
        }
      ]
    },
    {
      "id": "Q03",
      "type": "single_choice",
      "text": "您的专业类别是",
      "construct": "人口学",
      "variable": "major",
      "measurement_level": "nominal",
      "options": [
        {
          "id": "A",
          "label": "人文社科类",
          "value": 1
        },
        {
          "id": "B",
          "label": "理工类",
          "value": 2
        },
        {
          "id": "C",
          "label": "经管类",
          "value": 3
        },
        {
          "id": "D",
          "label": "医学类",
          "value": 4
        },
        {
          "id": "E",
          "label": "其他",
          "value": 99,
          "other_text": true
        }
      ]
    },
    {
      "id": "Q04",
      "type": "single_choice",
      "text": "您是否使用过AI学习工具（如ChatGPT、文心一言、Kimi等）",
      "construct": "使用行为",
      "variable": "used_ai",
      "note": "筛选题",
      "options": [
        {
          "id": "A",
          "label": "使用过",
          "value": 1
        },
        {
          "id": "B",
          "label": "没有使用过",
          "value": 2
        }
      ]
    },
    {
      "id": "Q05",
      "type": "single_choice",
      "text": "您使用AI学习工具的频率是",
      "construct": "使用行为",
      "variable": "usage_frequency",
      "analysis_role": "independent_variable",
      "measurement_level": "ordinal",
      "options": [
        {
          "id": "A",
          "label": "每天多次",
          "value": 1
        },
        {
          "id": "B",
          "label": "每天一次",
          "value": 2
        },
        {
          "id": "C",
          "label": "每周几次",
          "value": 3
        },
        {
          "id": "D",
          "label": "每月几次",
          "value": 4
        },
        {
          "id": "E",
          "label": "更少",
          "value": 5
        }
      ]
    },
    {
      "id": "Q06",
      "type": "multiple_choice",
      "text": "您主要通过哪些渠道使用AI学习工具（可多选）",
      "construct": "使用行为",
      "variable": "usage_channels",
      "options": [
        {
          "id": "A",
          "label": "网页版",
          "value": 1
        },
        {
          "id": "B",
          "label": "手机App",
          "value": 2
        },
        {
          "id": "C",
          "label": "微信小程序",
          "value": 3
        },
        {
          "id": "D",
          "label": "其他",
          "value": 99,
          "other_text": true
        }
      ]
    },
    {
      "id": "Q07",
      "type": "multiple_choice",
      "text": "您主要用AI学习工具完成哪些学习任务（可多选）",
      "construct": "使用行为",
      "variable": "usage_tasks",
      "options": [
        {
          "id": "A",
          "label": "课程作业",
          "value": 1
        },
        {
          "id": "B",
          "label": "论文写作",
          "value": 2
        },
        {
          "id": "C",
          "label": "语言学习",
          "value": 3
        },
        {
          "id": "D",
          "label": "编程学习",
          "value": 4
        },
        {
          "id": "E",
          "label": "知识问答",
          "value": 5
        },
        {
          "id": "F",
          "label": "其他",
          "value": 99,
          "other_text": true
        }
      ]
    },
    {
      "id": "Q08",
      "type": "likert",
      "text": "为确认您在认真作答，本题请选择\"一般\"",
      "construct": "质量控制",
      "variable": "attention_check_1",
      "attention_check": true,
      "scale": {
        "min": 1,
        "max": 5,
        "labels": [
          "非常不同意",
          "不同意",
          "一般",
          "同意",
          "非常同意"
        ],
        "values": [
          1,
          2,
          3,
          4,
          5
        ]
      }
    },
    {
      "id": "Q09",
      "type": "matrix_single",
      "text": "请评价您对AI学习工具以下方面的满意程度",
      "construct": "满意度",
      "variable_prefix": "sat",
      "analysis_role": "dependent_variable",
      "rows": [
        {
          "id": "R1",
          "text": "答案生成质量",
          "variable": "sat_quality"
        },
        {
          "id": "R2",
          "text": "响应速度",
          "variable": "sat_speed"
        },
        {
          "id": "R3",
          "text": "操作易用性",
          "variable": "sat_ease"
        },
        {
          "id": "R4",
          "text": "内容丰富度",
          "variable": "sat_richness"
        }
      ],
      "scale": {
        "min": 1,
        "max": 5,
        "labels": [
          "非常不满意",
          "不满意",
          "一般",
          "满意",
          "非常满意"
        ],
        "values": [
          1,
          2,
          3,
          4,
          5
        ]
      }
    },
    {
      "id": "Q10",
      "type": "likert",
      "text": "总体而言，我对AI学习工具的使用体验感到满意",
      "construct": "满意度",
      "variable": "overall_satisfaction",
      "analysis_role": "dependent_variable",
      "scale": {
        "min": 1,
        "max": 5,
        "labels": [
          "非常不同意",
          "不同意",
          "一般",
          "同意",
          "非常同意"
        ],
        "values": [
          1,
          2,
          3,
          4,
          5
        ]
      }
    },
    {
      "id": "Q11",
      "type": "likert",
      "text": "使用AI学习工具常常让我难以集中注意力",
      "construct": "满意度",
      "variable": "distraction",
      "analysis_role": "dependent_variable",
      "reverse_scored": true,
      "note": "反向题（属满意度构念）：同意程度越高=满意度构念得分应越低，计分前需反向处理",
      "scale": {
        "min": 1,
        "max": 5,
        "labels": [
          "非常不同意",
          "不同意",
          "一般",
          "同意",
          "非常同意"
        ],
        "values": [
          1,
          2,
          3,
          4,
          5
        ]
      }
    },
    {
      "id": "Q12",
      "type": "textarea",
      "text": "您希望AI学习工具有哪些改进？请具体描述",
      "construct": "开放建议",
      "variable": "improvement_suggestion"
    }
  ],
  "logic": [
    {
      "id": "L1",
      "type": "visibleIf",
      "target": "Q05",
      "condition": {
        "question": "Q04",
        "operator": "in",
        "value": [
          "A"
        ]
      }
    },
    {
      "id": "L2",
      "type": "visibleIf",
      "target": "Q06",
      "condition": {
        "question": "Q04",
        "operator": "in",
        "value": [
          "A"
        ]
      }
    },
    {
      "id": "L3",
      "type": "visibleIf",
      "target": "Q07",
      "condition": {
        "question": "Q04",
        "operator": "in",
        "value": [
          "A"
        ]
      }
    },
    {
      "id": "L4",
      "type": "visibleIf",
      "target": "Q09",
      "condition": {
        "question": "Q04",
        "operator": "in",
        "value": [
          "A"
        ]
      }
    },
    {
      "id": "L5",
      "type": "visibleIf",
      "target": "Q10",
      "condition": {
        "question": "Q04",
        "operator": "in",
        "value": [
          "A"
        ]
      }
    },
    {
      "id": "L6",
      "type": "visibleIf",
      "target": "Q11",
      "condition": {
        "question": "Q04",
        "operator": "in",
        "value": [
          "A"
        ]
      }
    }
  ],
  "metadata": {
    "source": "SurveyCraft 官方示例",
    "created_at": "2026-09-16"
  }
}